Group,Headline1,Headline2,Description,Path,FinalURL
Powder Coat Cure Main,Powder-Coat Cure Certificate in 30s,Qualicoat & ISO 2368 Ready,"Upload CSV, get PASS/FAIL PDF/A-3 + SHA-256. Free 3 jobs.",powder-coat,https://proofkit.dev/?utm_source=google&utm_medium=cpc&utm_campaign=industry_powder&utm_content=headline1
Powder Coat Cure Alt,Quality Control Made Simple,CSV to Compliant Certificate,"Any industry. Upload data, get tamper-proof PDF/A-3 report.",powder-coat,https://proofkit.dev/?utm_source=google&utm_medium=cpc&utm_campaign=industry_powder&utm_content=headline2
Powder Coat Compliance,ISO 2368 Compliance Simplified,Automated Cure Validation,"Professional powder coat cure certificates. Upload logger data, get inspector-ready PDF.",powder-coat,https://proofkit.dev/?utm_source=google&utm_medium=cpc&utm_campaign=industry_powder&utm_content=compliance
Powder Coat Quick,30-Second Cure Certificates,No More Manual Calculations,"Transform CSV data into compliant reports instantly. Free trial available.",powder-coat,https://proofkit.dev/?utm_source=google&utm_medium=cpc&utm_campaign=industry_powder&utm_content=quick
Powder Coat Professional,Professional Grade Validation,Qualicoat Audit Ready,"Generate tamper-proof cure certificates with SHA-256 verification. Industry standard.",powder-coat,https://proofkit.dev/?utm_source=google&utm_medium=cpc&utm_campaign=industry_powder&utm_content=professional