Company,Contact_Email,Contact_Name,Phone,Website,Primary_Products,Target_Industries,Partnership_Priority,Notes
Astell Scientific,[email protected],Sales,+44 20 8309 2031,https://astell.com,"Autoclaves, AstellBio EDS, Steam Generators","Hospitals, labs, biowaste",High,"140 years; add Astell-branded PDF/A-3 certificate bundles from cycle/EDS exports"
Priorclave,[email protected],Sales + Support,+1 800-470-2965,https://www.priorclave.com/en-us/,"Research autoclaves with Tactrol","Academia, QA labs, food/pharma",High,"Energy/water savings; add Priorclave-branded certificate bundles"
Belimed Life Science,[email protected],Team,+41 71 499 40 00,https://www.belimed-lifescience.com/,"cGMP sterilizers, washers","Pharma, biopharma",Medium,"Add Belimed-branded certificate bundles for audits and tenders"
Getinge USA,customercare-US@getinge.com,Customer Care,+1 888 943 8872,https://www.getinge.com/us/,"Sterile reprocessing, washers, sterilizers","Hospitals, SPD",Medium,"Add Getinge-branded certificate bundles from cycle exports"
Topa Thermal,[email protected],Team,+31 252 245 315,https://topathermal.com/,"Connex 7D/ECO, pallet shippers, EZCODE","Pharma, clinical trials",Medium,"Attach certificate bundles to monitored shipments and 7D lanes"
Sonoco ThermoSafe,[email protected],Sales Team,800-323-7442,https://www.thermosafe.com/,"Insulated shippers, pallet/rental, Orion r, Pegasus ULD","Life sciences, healthcare",High,"Attach PDF/A-3 cert bundles from telemetry/monitor exports"
